Role	Level	Blurb	Image
Valkyrie	107	You have until <rolename> is finished drinking this giant jug of alcohol to be them, <name>. After that you're Wade Wilson, but it's not so bad. At least he can't die.	https://cdn.discordapp.com/attachments/794506942906761226/882512766643077140/valkyrie.gif
Wade Wilson	108	MAXIMUM EFFORT <name>, you're <rolename>. The merc with a mouth, the pan with a plan, the incorrigible immortal Deadpool.	https://cdn.discordapp.com/attachments/794506942906761226/882512907005489162/wade_wilson.gif
Rio	109	I can't say anything without incriminating myself here, <name>, so just uh congrats you're <rolename>. *insert gif of Jesse from Breaking Bad drinking water for his intense thirst*	https://cdn.discordapp.com/attachments/794506942906761226/887608079384973332/109rio.gif
John Constantine	110	Congratulations <name>! You're now chaotic enough to be <rolename>, but it's too late. Fuckin RIP in Peace, motherfucker.	https://cdn.discordapp.com/attachments/794506942906761226/882512109659889674/john_constantine_2.gif
Mobius M. Mobius	111	You're living your best life in Egypt on a jetski as <rolename>, <name> and we love you for it. 	https://cdn.discordapp.com/attachments/794506942906761226/882512368540712970/mobius.gif
Leonard Snart	112	<name>, you're <rolename>. You're hot, you're bi, and you're a chaotic thieving mastermind. The only thing you've ever done wrong, aside from being a massive bastard and villain, is die.	https://cdn.discordapp.com/attachments/794506942906761226/871322619901771786/17_LeonardSnart.gif
Alucard	113	YOU'RE <rolename>, <name>. YOU'RE KING VAMP. THE VAMP KING.	https://cdn.discordapp.com/attachments/794506942906761226/882511495655747584/alucard.gif
Natasha Romanoff	114	The most important thing to remember about being <rolename>, <name>, is that no matter what anyone says: you're still alive.	https://cdn.discordapp.com/attachments/794506942906761226/882512397837938720/natasha_romanoff.gif
Loki Laufeyson	115	Are you in Hel, <name>? Because you're <rolename>. It's not funny, but it might be true.	https://cdn.discordapp.com/attachments/794506942906761226/882512206900658226/loki.gif
Astra Logue	117	Congratulations <name>! You're <rolename>. You clawed your way back from hell and we love you and your tall queer energy.	https://cdn.discordapp.com/attachments/794506942906761226/882511590757384262/astra_logue.gif
Mantis	118	You deserve better, my beloved. You deserved so much better than this. You're <rolename>, <name>, and you deserve the entire world.	https://cdn.discordapp.com/attachments/794506942906761226/882512266187116644/mantis.gif
Mazikeen "Maze" Smith	119	Guess what, <name>! You’re <rolename>! Go forth and be hot and demonic.	https://cdn.discordapp.com/attachments/794506942906761226/882512285350920282/maze.gif
Keanu Reeves	120	You're <rolename>, <name>. I'm thinking you're back. It's personal.	https://cdn.discordapp.com/attachments/794506942906761226/882512117754912778/keanu_reeves.gif
Yelena Belova	121	Unlike some people you're no poster, <name>. You're a flyer. A pamphlet. An infographic. *A Plastic Bag*. You're <rolename>!	https://cdn.discordapp.com/attachments/794506942906761226/882512906921590834/yelena_belova.gif
Gideon	122	Congratulations <name>! You're <rolename>. You might have other people fooled with your sexy voice and your helpful quips, but not us. We know you're a master of chaos and we love you anyway.	https://cdn.discordapp.com/attachments/794506942906761226/882511991942578226/gideon.gif
Santana Lopez	123	You're the queen of everything, <name>. The original queen bee <rolename>. You'd kick Cheryl's ass any day of the week. Arguably the best character on Glee. You should've been the main character and we all know it. Get fucked, Rachel Barry.	https://cdn.discordapp.com/attachments/794506942906761226/887608441693151282/123Santana.gif
Sylvie Laufeydottir	124	It's all about you, <name>! Have fun burning the system down as <rolename>.	https://cdn.discordapp.com/attachments/794506942906761226/882512761773494282/sylvie.gif
Mariah Carey	125	Look, <name>, it's holiday season and what would holiday season be without <rolename>, eh?	https://cdn.discordapp.com/attachments/794506942906761226/887608450933198858/125Mariah.gif
Baron Helmut Zemo	127	Congratulations on being vaguely european (and probably super gay idfk), <name>, you're <rolename>.	https://cdn.discordapp.com/attachments/794506942906761226/882512871932723241/zemo.gif
Alec Holland	128	Congratulations, <name>, you are the literal human embodiment of a swamp, aka <rolename>, aka The Swamp Thing himself. What else is there to say? The rest of us merely adopted the swamp, but you were born in it. We bow to your superior swampiness.	https://cdn.discordapp.com/attachments/794506942906761226/882511579235618837/alec_holland.gif
Shrek	129	You used to be the king of this swamp, <name>, but now you've been dethroned. Have fun being a loser as <rolename>.	https://cdn.discordapp.com/attachments/794506942906761226/882512577593233428/shrek.gif
Cardi B	130	You're the queen of this swamp <name>! The one and only <rolename>!! Okurrr??	https://cdn.discordapp.com/attachments/794506942906761226/882511795263250462/cardi_b.gif
Nana Rose	131	Cheryl likes to pretend she invented red, but it was you, wasn't it, <name>? After all, as <rolename> you've been around for centuries. You've outlived a hundred Eobard Thawnes. A Million. You predate colours. You predate the Earth itself. You are endless. You are eternal.	https://cdn.discordapp.com/attachments/794506942906761226/882512412895498290/nana_rose.gif
Super Mega Supreme Bastard	140	Congratulations <name>! You're <rolename>. I don't know how to say this, but you've somehow become more of a chaotic swampy wench than the actual devil. Are you okay? Do you need us to call someone?	https://cdn.discordapp.com/attachments/794506942906761226/871326195046838272/100_supreme.gif