Role	Level	Blurb	Image
The Most Precious Cinnamon Roll	0	Congratulations <name>! You're <rolename>, welcome to Cinnabon.	https://cdn.discordapp.com/attachments/794506942906761226/871322011002081320/0_CinnamonRoll.gif
Miles Morales	1	Congrats <name> you're <rolename>! The best Spider-Man to ever Spider-Man. Yes, even better than the original. No, I don't take critique.	https://cdn.discordapp.com/attachments/794506942906761226/882512311678545930/miles_morales.gif
Miguel Rivera	2	Remember me, <name>? You're <rolename>!	https://cdn.discordapp.com/attachments/794506942906761226/887608321903833088/2miguelrivera.gif
Yolanda Montez	3	Congratulations <name>! You're <rolename>. You are a fierce protector of your friends, an excellent fighter, and an even better Wild Cat. Even though you mess up sometimes and you haven't had the best go of it lately, you've still got a good heart and good intentions. Stay wild, you chaotic child.	https://cdn.discordapp.com/attachments/794506942906761226/882512891394285589/yolanda_montez.gif
Michelle "MJ" Jones	4	Congrats <name> you're <rolename>! The best MJ to ever MJ. Yes, even better than the original. No, I don't take critique.	https://cdn.discordapp.com/attachments/794506942906761226/882512245161082890/michelle_MJ_Jones.gif
Riri Williams	5	You're <rolename>, a hero with a heart of iron <name>. You're a genius who doesn't run away when things get tough, you protect the people you love and you always fight for what's right, even at the ecpense of your own self.	https://cdn.discordapp.com/attachments/794506942906761226/871322985347309598/27_RiriWilliams.gif
Luz Noceda	7	Are you a cinnamon roll stuck in a demon realm, <name>? Because you're <rolename>.	https://cdn.discordapp.com/attachments/794506942906761226/887608191280619560/7luz.gif
Ronnie Lee	8	Congrats <name>, you're <rolename>! You're just trying to do your job, but people keep getting in the way. You're honestly the only person who actually has their shit together.	https://cdn.discordapp.com/attachments/794506942906761226/882512576733388851/ronnie_lee.gif
James "Rhodey" Rhodes	9	Congratulations <name>, you're <rolename> best of luck tracking down the grapefruit man that kidnapped your best friend and almost grapefruited him to death.	https://cdn.discordapp.com/attachments/794506942906761226/882512498501251082/rhodey.gif
Ava Sharpe	10	Congratulations <name>! You're <rolename>. You're a lesbian who can kick ass in fights and likes spinning swords around high level swampy style.	https://cdn.discordapp.com/attachments/794506942906761226/882511615025614878/ava_sharpe.gif
Edward Cullen	11	Slurp Slurp, <name>. Slurp, motherfucking, slurp. You're <rolename>.	https://cdn.discordapp.com/attachments/794506942906761226/882511990139002890/edward_cullen.gif
Joaquin Torres	12	Caw motherfucking caw, <name>. You're <rolename>!	https://cdn.discordapp.com/attachments/794506942906761226/882512112923078656/Joaquin_Torres.gif
Melinda May	13	<name> you’re <rolename>, a one-woman fighting machine who kicks ass as one of S.H.I.E.L.D.’s deadliest agents. You’re as swift as a coursing river, with all the force of a great typhoon, with all the strength of a raging fire, and mysterious as the dark side of the moon.	https://cdn.discordapp.com/attachments/794506942906761226/882512222197252096/melinda_may.gif
Octavius	14	You might have some Deja Vu, <name> because you're <rolename>. If you know, you know.	https://cdn.discordapp.com/attachments/794506942906761226/871323164553138197/32_octavius.gif
Jughead Jones	15	<name>, you're <rolename>, a self-proclaimed weirdo. In case you haven't noticed, you're weird. You don't fit in and you don't wanna fit in. 	https://cdn.discordapp.com/attachments/794506942906761226/882511754331029534/barryhead.gif
Betty Cooper	17	You’re <rolename>, <name> Riverdale’s resident sleuth and Girl Next Door with a dark side. You’re the Serpent Queen, a carrier of the serial killer gene, and your mom may or may not be in an organ-harvesting cult.	https://cdn.discordapp.com/attachments/794506942906761226/882511758370172978/betty_cooper.gif
Sam Wilson	18	Falcon **punch**, <name> you're <rolename>. You're the captain now, we never needed Steve anyways.	https://cdn.discordapp.com/attachments/794506942906761226/882512540532375612/sam_wilson.gif
Ben Wyatt	19	It's all about the cones <name>! That's right, you're <rolename>! You're tired all the time and you just want to do you job, but sometimes the antics of those around you get in your way so you make some bullshit Claymation videos and cry into your cone game. Get rekt, I guess?	https://cdn.discordapp.com/attachments/794506942906761226/882511684114202654/ben_wyatt.gif
Bella Swan	20	Some people say you have the personality of beige, <name>, but how else are you supposed to seduce a fussy vampire? That's right, you're <rolename>. Enjoy Forks or whatever.	https://cdn.discordapp.com/attachments/794506942906761226/882511771368325141/bella_swan.gif
Martin Stein	21	ASTONISHING! Congratulations <name>! You're <rolename>.	https://cdn.discordapp.com/attachments/794506942906761226/882512255525199922/martin_stein.gif
Jubilation "Jubilee" Lee	22	You're <rolename>, <name>. You shoot fireworks out of your hands and you're amazing. 🎆	https://cdn.discordapp.com/attachments/794506942906761226/882512128576208926/jubilee.gif
Jimmy Woo	23	<name>, you're <rolename>, FBI Agent, magician, SHIELD agent, youth pastor, assembler of the G-Men and Agents of Atlas, is there anything Jimmy Woo can't do.	https://cdn.discordapp.com/attachments/794506942906761226/882512138575441940/jimmy_woo.gif
Jedediah	24	Congratualations <name>! You're GAY (and so is <rolename>)!!!	https://cdn.discordapp.com/attachments/794506942906761226/871323457730785290/39_Jed.gif
Steve Rogers	25	You're <rolename>, <name>. You're self-righteous and always think you're right even when you're wrong, but you do have a way of standing up for the little guy. SOMETIMES, when you're not being an absolute cad. Not very well-liked here in The Swamp, but still somehow an American hero. 	https://cdn.discordapp.com/attachments/794506942906761226/882512728156151828/steve_rogers.gif
Dora the Explorer	27	Come on vámonos, <name>, let's go! Come on let's get to it, you're <rolename>!	https://cdn.discordapp.com/attachments/794506942906761226/887608220980510720/27Dora.gif
Renesmee Cullen	28	Your name sucks <name>, but at least you're nicknamed after the Loch Ness Monster! You're <rolename>.	https://cdn.discordapp.com/attachments/794506942906761226/882512427428769822/renesmee_cullen.gif
Dean Winchester	29	¡Felicidades, <name>, eres <rolename>! Definitivamente eres 100% hetero, a menos que te pregunten en español ;)	https://cdn.discordapp.com/attachments/794506942906761226/882511924674297856/dean_winchester.gif
April Ludgate	30	<name> you're now chaotic enough to be <rolename>. You really like games that turn people against each other.	https://cdn.discordapp.com/attachments/794506942906761226/882511485685874688/april_ludgate.gif
Lupita Nyong'o	31	Don't freeze, <name>! You're <rolename>!	https://cdn.discordapp.com/attachments/794506942906761226/887608329793306665/31Lupita.gif
Helen Cho	32	<name> you're the brilliant geneticist <rolename>. I don't understand. You built ~~this program~~ Phil. Why is it trying to kill us?	https://cdn.discordapp.com/attachments/794506942906761226/882511995499343882/helen_cho.gif
Kevin Tran	33	<name>, the prophecy says you're <rolename>. You translated the Leviathan tablet which led to the downfall of Dick.	https://cdn.discordapp.com/attachments/794506942906761226/882512078785642526/kevin_tran.gif
Rip Hunter	34	Congratulations <name>! You're <rolename>. You used to be the captain, but now you're second fiddle on your own time ship. Gideon might still love you cos she has to, but cake can only get you so far with the crew .	https://cdn.discordapp.com/attachments/794506942906761226/882512516352213012/rip_hunter.gif
Castiel	35	<name> has ascendido a ser <rolename>. Aunque eres todo un ángel tienes muy mala suerte con los hombres. Pero puedes ganar el primer premio en un concurso de cosplayers de Constantine sin mucho esfuerzo.	https://cdn.discordapp.com/attachments/794506942906761226/882511708885745664/castiel.gif
Jacob Black	37	Why don't you take a seat right over there <name>? Let's have a long chat about you being <rolename>.	https://cdn.discordapp.com/attachments/794506942906761226/882511997680377856/jacob_black.gif
Mick Rory	38	<name>, you're <rolename>. Congratulations on the birth of your million little snot bubbles, I guess????	https://cdn.discordapp.com/attachments/794506942906761226/882512283731886081/mick_rory.gif
Jane Foster	39	You're a literal genius who falls in love with a god, <name> and like <rolename>, you're also seen as a Mary Sue of sorts, which is really unfair because you kick ass in the comics and it's not like you're fault your introduction to the MCU was written by people who have no clue how genuinely special you are.	https://cdn.discordapp.com/attachments/794506942906761226/882511889039499314/jane_foster.gif
Elliot Alderson	40	Hello world <name>. You're the one and only <rolename>. Hackerman supreme. So supreme you hacked the entire government and got rid of debt and you did it all while caught in the maze that is your internal thoughts. Kudos, man.	https://cdn.discordapp.com/attachments/794506942906761226/882511977518366740/elliot_alderson.gif
Zari Tomaz	41	Congratulations <name>! You're <rolename>. Enjoy being a hacker with wind powers and a bad attitude!	https://cdn.discordapp.com/attachments/794506942906761226/882512894997180436/zari_tomaz.gif
Cisco Ramon	42	Congratulations <name> You're <rolename> Badass hacker, serial monogamist, genius computer boi, and full of chaotic pun-slinging energy.	https://cdn.discordapp.com/attachments/794506942906761226/882511913261596692/cisco_ramon.gif
Amaya Jiwe	43	Congratulations <name>! You're <rolename>, the mother of all Vixens and a badass totem master who is constantly the voice of reason.	https://cdn.discordapp.com/attachments/794506942906761226/882511533786136647/amaya_jiew.gif
Leah Clearwater	44	Congratulations <name>, you're <rolename> the only valid character in Twilight.	https://cdn.discordapp.com/attachments/794506942906761226/882513169782804580/leah_clearwater.gif
Stevie Budd	45	<name>, you're <rolename>. A sarcastic hotel receptionist who doesn't take shit from anyone. You're a little bit mean and a lotta bit chaotic. 	https://cdn.discordapp.com/attachments/794506942906761226/882512762742386719/stevie-budd.gif
Astrid Leong	47	You're <rolename>, <name>. Nick's most famous and most favorite cousin. You're the only person in the Crazy Rich Asian series that's never tried to kill Rachel	https://cdn.discordapp.com/attachments/794506942906761226/882511573413949520/astrid_leong.gif
Gabriella Montez	48	We're all in this together, <name>! You're <rolename>. WHAT TEAM? WILDCATS. Sing your heart out. Go after your dreams. Run, barry, run!	https://cdn.discordapp.com/attachments/794506942906761226/882511877182210058/gabriella_montez.gif
Peter Parker	49	You're everyone's favourite webhead, <rolename>, <name>. You've swung into our hearts with your witty oneliners and, depending on the adaptation, dry sense of humor. Stay spidery, my friend.	https://cdn.discordapp.com/attachments/794506942906761226/882512373628407838/peter_parker_1.gif
Billy Ray Cyrus	50	Oh, sweet achy breaky niblets <name>, you're <rolename>! No one can pull off a mullet and flannel shirt combo quite like you. The only thing stronger than your hair game is your weed vault, which makes you the chillest, swampiest rockstar around, dang nabbit!	https://cdn.discordapp.com/attachments/794506942906761226/882511777303252992/bully_ray_cyrus.gif
Kendra Saunders	51	Nice! Congratulations <name>! You're <rolename> and you were *totally* just a barista before you became a ~~furry~~ Hawk Goddess.	https://cdn.discordapp.com/attachments/794506942906761226/882512100327555112/kendra_saunders_2.gif
Alice Cullen	52	You're bisexual af, <name>, but the compulsory heterosexuality got you and paired you off with a...well...A sad gamer boyfriend? Maybe? If that gamer boyfriend was a literal confederate soldier who might actually be a sociopath, I mean. That's right, you're <rolename>.	https://cdn.discordapp.com/attachments/794506942906761226/882511572700897330/alice_cullen.gif
Professor Charles Xavier	53	Let's get cereboral in here, <name>! You're <rolename>!	https://cdn.discordapp.com/attachments/794506942906761226/882511798710960178/charles_xavier.gif
Jefferson "Jax" Jackson	54	Congratulations <name>! You're <rolename>. You burned your way into our hearts as one half of Firestorm and you are the only valid man in existence. 	https://cdn.discordapp.com/attachments/794506942906761226/882511969930862632/jax.gif
George Takei	55	Oh my, <name>, you're <rolename> author, actor, TV personality, and arguably the most iconic person to ever live. 	https://cdn.discordapp.com/attachments/794506942906761226/882511911730708500/george_takei.gif
Lauren Vélez	57	Most people don't know this about you, <name>, but you have a~~n evil~~ twin! Just like <rolename>.	https://cdn.discordapp.com/attachments/794506942906761226/887608347598135306/57LaurenVelez.gif
Archie Andrews	58	You’re <rolename>, <name>! You may be a dumbass but at least you know the triumphs and defeats, the epic highs and lows of high school football. You also survived a bear attack and will not hesitate to tell everyone about it.	https://cdn.discordapp.com/attachments/794506942906761226/882511524160229376/archie_abrams_2.gif
Behrad Tarazi	59	Congratulations <name>! You're <rolename> a chaotic cinnamon roll with a loom anxiety.	https://cdn.discordapp.com/attachments/794506942906761226/882511506951012393/1Behrad_Tarazi.gif
Lightning McQueen	60	Life is a highway, <name>, and you're about to ride it all night long as <rolename>.	https://cdn.discordapp.com/attachments/794506942906761226/882512229327585320/lightning_mcqueen.gif
Shuri	61	Wakanda Forever <name>! You're <rolename>, queen of our hearts and future ruler of Wakanda. You love chaos and memes and have a very special place here in The Swamp.	https://cdn.discordapp.com/attachments/794506942906761226/882512519837655050/shuri.gif
Taika Waititi	62	“A ~~set~~ swamp should be like a family, except that you all actually like each other.” Congratulations <name> you're legendary director/actor/producer/writer/comedian/inventor/artist overall badass, <rolename>	https://cdn.discordapp.com/attachments/794506942906761226/882512674896883732/taika_waititi.gif
Diego Luna	63	So we meet again, <name>. You've made enough appearances in the swamp by now to get your own level <rolename>. Completely independent of that unfortunate daddy quiz.	https://cdn.discordapp.com/attachments/794506942906761226/887608350613864458/63Diego.gif
Charlie Swan	64	You're daddy <name>. No context. Just...Daddy.	https://cdn.discordapp.com/attachments/794506942906761226/882511809880416287/charlie_swan.gif
Magneto	65	Do not adjust your vaccine, <name>, you're <rolename> which means you're magnetic! Enjoy your 5G.	https://cdn.discordapp.com/attachments/794506942906761226/882512274244390912/magneto.gif
Tenoch Huerta	67	Congratulations, <name>, you're HOMO SUPERIOR!!!!!! (And swampy af because you're <rolename>.)	https://cdn.discordapp.com/attachments/794506942906761226/887608243654889513/67Tenoch.gif
Donna Meagle	68	<name> you're the baddest bitch in the game, chaos and sass incarnate, <rolename>!	https://cdn.discordapp.com/attachments/794506942906761226/882511893997182996/donna_meagle.gif
Wally West	69	Congratulations <name>! You're <rolename>. You love a good prank, you've got a need for speed, and a nose for chaos!	https://cdn.discordapp.com/attachments/794506942906761226/882512837061263360/wally_west.gif
David Rose	70	Great job <name>, you're <rolename>. A bad bitch, business owner, and all around sarcastic little shit. You try to keep everyone at arm's length because you've been hurt so often in your life, but after your time in Schitt's Creek you've become a big ol' softie. 	https://cdn.discordapp.com/attachments/794506942906761226/882511957050130432/david_rose.gif
Dick Grayson	71	Caw motherfucking caw 2: electric boogalo, <name>. You're <rolename>! (Yes, you're allowed to make a dick joke).	https://cdn.discordapp.com/attachments/794506942906761226/887608382150811678/71Dick.gif
Reggie Mantle	72	Really the only thing I know about this role, <name>, is that Veronica punched <rolename> in the face really hard once and it was kind of awesome. I don't go here and Megan is asleep.	https://cdn.discordapp.com/attachments/794506942906761226/882512453534101544/rggie_mantle.gif
Troy Bolton	73	WHAT TEAM? WILD CATS! Did you know, fun fact, <name> that <rolename> isn't even the one to say this with the craziest face in the movies? I have no idea what's going on it's 11pm and I'm really just trying to reset the Swampys. None of y'all read these, right? 	https://cdn.discordapp.com/attachments/794506942906761226/882512752642523157/troy_bolton.gif
Dwayne "The Rock" Johnson	74	*raises eyebrow* Jabroni, it doesn't matter what you think you are, <name>, because now you're <rolename>.	https://cdn.discordapp.com/attachments/794506942906761226/882512713576763402/the_rock.gif
Mona Wu	75	Congratulations <name>! You're <rolename>, the best and most chaotic triple threat! If being a triple threat means you're a Literary Agent / Kaupe / Novelist. 	https://cdn.discordapp.com/attachments/794506942906761226/882512414661283850/mona_wu.gif
Luis	77	So it's like this, <name>. You were at the Met Gala serving ice cream with your cousin Ernesto, when the most beautiful man you've ever seen wanders over and introduces himself to you and asks for a cone. So you tell him your name is <rolename> and you serve him the cone and your hands brush and his buddy Sam makes a joke about it because he gives you a *look* and you're one hundred percent sure this is the man you're gonna marry, right? Like your whole life together flashes before your eyes from the touch of a hand, dude. You're never gonna be the same after this. 	https://cdn.discordapp.com/attachments/794506942906761226/887608398995128350/77luis.gif
Chad Danforth	78	Listen, <name>. <rolename> is here because he is a raging bisexual and someone needed to fucking say it. And that person is going to be ME. 	https://cdn.discordapp.com/attachments/794506942906761226/882511726250197033/chad_danforth.gif
Ryan Evans	79	So, <name>, you've made it this far. To <rolename>, another queer. This is truly a milestone because the next 3 levels are pretty much all the same colour pink so good luck knowing who you are. Cos Disney sure didn't know who <rolename> was when they tried to pair his ass off with Kelsey and not Chad. Yes, I plan on suing for emotional damages. 	https://cdn.discordapp.com/attachments/794506942906761226/882512544521134090/ryan_evans.gif
Alexis Rose	80	Oh my God, <name>, you're <rolename>. Pubic Relations Afficianado who also happens to be good at *public* relations. It took you way too long to figure yourself out, but it's fine to go at your own pace. You definitely got your shit together at the end!	https://cdn.discordapp.com/attachments/794506942906761226/882511613318533150/alexis_rose.gif
Darcy Lewis	81	I don't think anyone is surprised to see <rolename> finally made the roster. Especially considering all that recent ***unpleasantness*** regarding ***unpleasant things***. Are we, <name>?	https://cdn.discordapp.com/attachments/794506942906761226/887608445098950676/81Darcy.gif
Tom Haverford	82	Treat yo' self <name>. You're <rolename>! You can get in your own way sometimes and you don't think twice about stepping on other people to get your own way. Which might make you a bit of a jerk, but you figure out what matters in the end!	https://cdn.discordapp.com/attachments/794506942906761226/882512718878343188/tom_haverfod.gif
Cheryl "Bombshell" Blossom	83	You’re <rolename>, <name> you wretched child. You’re hella gay, cuckoo-bananas, and you invented the color red. You ARE red. 	https://cdn.discordapp.com/attachments/794506942906761226/882511785540878356/cheryl_blossom.gif
Aaron Davis	84	_shoulder touch_ Hey, <name>. You're <rolename>. Stay on the prowl.	https://cdn.discordapp.com/attachments/794506942906761226/882511606330843136/aaron_davis.gif
Zari Tarazi	85	Congratulations <name>! You're <rolename>, the queen of self-help videos and makeup tutorials. You built your business from the ground up with your dragon, Mithra, by your side and became one of the most chaotic queer queens of 2044. Chaos is your brand and we absolutely love you for it.	https://cdn.discordapp.com/attachments/794506942906761226/882512898168061952/zari_tarazi.gif
Zed Martin	87	Hope you like being psychic and eating pickles, <name> because you're <rolename>!	https://cdn.discordapp.com/attachments/794506942906761226/882512861975433216/zed_martin.gif
Esperanza "Spooner" Cruz	88	Congratulations <name>! You're <rolename>. You're the rootin'-est tootin'-est alien tech gunslinger of all time. Yes this is a joke about Texas. No, I will not elaborate.	https://cdn.discordapp.com/attachments/794506942906761226/882512699513266207/spooner.gif
Rogue	89	Congratulations sugar, you're <rolename>. You're from the deep south and you can be a southern belle when committed, but don't get it twisted <name>, you could also pick up a car and throw it or suck the life out of anyone who dares touch you. Pretty badass if you ask me.	https://cdn.discordapp.com/attachments/794506942906761226/882512473016659968/rogue.gif
Tony Stark	90	<name>, you're <rolename>. The genius, billionaire, playboy, philanthropist we all adore and the one and only Iron Man.	https://cdn.discordapp.com/attachments/794506942906761226/882512728286195773/tony_stark.gif
Donkey	91	<name>, you absolute ass, you're <rolename>. Keep on dancing your way up the leaderboard, eating waffles on your way up.	https://cdn.discordapp.com/attachments/794506942906761226/882511981364514836/donkey.gif
Rogelio De La Vega	92	Your name is <rolename>, <name> and you're not afraid to shout it from the rooftops! You love being you. 100%. And all of your illegitimate children love you too.	https://cdn.discordapp.com/attachments/794506942906761226/887608424643301376/92rogelio.gif
Remy LeBeau	93	Bon travail, <name>, mon ami! Tu es <rolename>. Un voleur très sexy. Vous pouvez voler n'importe quelle serrure et gagner n'importe quel cœur, mais que ça ne te monte pas à la tête.	https://cdn.discordapp.com/attachments/794506942906761226/882512353655140382/remy_lebeau.gif
Oscar Isaac	94	You were almost Gomez Addams, <name>, and for that you must be immortalized as <rolename>.	https://cdn.discordapp.com/attachments/794506942906761226/887608167998050304/94oscar.gif
Sharon Carter	95	You get a bad rep, but that's because people don't take the time to get to know you, <name>. Like <rolename>, you're more than jhust the shitty surface level writing the MCU has been doling out for their female characters since the first Iron Man film. You deserve better and in this Swamp we will love you always.	https://cdn.discordapp.com/attachments/794506942906761226/882512583301693540/sharon_carter.gif
Rosario Dawson	97	You're iconic, <rolename> for your iconic roles and your iconic voice acting and that one book you narrated that I fell in love with because you narrated it. Also you played a queer lawyer on one of my favourite shows and I'll never forget that, okay? Oh right <name>, you've made it to the sexy level.	https://cdn.discordapp.com/attachments/794506942906761226/887608443781906482/97.gif
Lucifer Morningstar	98	Congratulations <name>! You are <rolename>. You are extremely chaotic, but also very charming. Also. Your accent is hot. Now tell me, what do you really desire?	https://cdn.discordapp.com/attachments/794506942906761226/882512282704285726/lucifer_morningstar.gif
Veronica Lodge	99	You're hot <name> and you might be evil. Like, you'd probably be more evil if Cheryl hadn't merc'd your ass right out of Queen Bee status by being the literal baddest bitch, but you're still <rolename> if that counts for something? You have really shitty taste in men. Like please stop marrying Chads and dating dudes that can only speak in sports metaphors. For the love of God.	https://cdn.discordapp.com/attachments/794506942906761226/882512852613726229/veronica_lodge.gif
Bad Bunny	100	¡Felicidades, <name>, you're <rolename> baby!	https://cdn.discordapp.com/attachments/323666308107599872/887615324831236097/5f690d65bdb33a0034b2c1f5.gif
Charlie	101	Congratulations <name>! You're <rolename>. Stay shapeshiftery, you boss ass immortal goddess of fate.	https://cdn.discordapp.com/attachments/794506942906761226/882511764456079360/charlie.gif
Nora Darhk	102	Congratulations <name>! You're now bastard enough to be <rolename>! You might've changed your ways now, but it doesn't erase the fact that you definitely tried to kill your future husband for an entire season.	https://cdn.discordapp.com/attachments/794506942906761226/882512397112320010/nora_darhk.gif
James Buchanan "Bucky" Barnes	103	<name> LET' S FEED THE BABIES	https://cdn.discordapp.com/attachments/794506942906761226/882511812359233556/bucky_barnes.gif
Camila "CinderGirlBoss" Cabello	104	So you're here now, <name>. In the darest of days, one of the swampiest of roles. The floppiest girlbossiest level to ever grace the swamp. You're <rolename>. I'm sorry, but I'm going to have to serve you a cease and desist for what you did to Rhythm Nation.	https://cdn.discordapp.com/attachments/794506942906761226/887608088901873714/104Camila.gif
Lil Nas X	105	Yee Haw and welcome to the Old Town Road, <name>. You’re almost there I promise. I know you’re tired but keep going u little bastard. -An actual tweet by <rolename>	https://cdn.discordapp.com/attachments/794506942906761226/882512238269857862/lil_nas_x.gif
