Role	Level	Blurb	Image
Firestar	113	For you, Slow. Here he is <rolename>, the little lad. I don't actually know if he's a little lad, but I'll find out when I start reading these books because what the fuck else am I gonna do with 2022? Not obsess over cats? Fuck that. <name>.	https://cdn.discordapp.com/attachments/794506942906761226/959912648961589258/111firestar.gif
Cat Thor	114	There are so many damn Thors I've lost track. <name>.	https://cdn.discordapp.com/attachments/794506942906761226/959913067129487450/112catthor.jpg
Glameow	115	I'm really just grasping at straws here, <name>. When it's happy, <rolename> demonstrates beautiful movements of its tail, like a dancing ribbon. It claws if displeased and purrs when affectionate. Its fickleness is very popular among some. 	https://cdn.discordapp.com/attachments/794506942906761226/959912649490042900/113glameow.gif
Gia	117	<rolename> (voiced by <name> in an Italian accent) is a beautiful jaguar who is part of the traveling circus in Madagascar 3: Europe's Most Wanted. She wears a blue woven floral necklace, has gold eyes and has heart-shaped palms. She is Alex's love interest who is always on the lookout to discover something new and gets her chance when she convinces a reluctant Alex to teach her the trapeze – "Circus Americano" style.	https://cdn.discordapp.com/attachments/794506942906761226/959940756963999794/114gia.gif
Vitani	118	You're the epitome of girlboss, <name>. You're the real murderface, <rolename>.	https://cdn.discordapp.com/attachments/794506942906761226/959912650282782850/115vitani.gif
Gilbert	119	Gilbert is Caillou’s pet cat and isn't a little bitch probably, idk I don't watch calluot. <name>.	https://cdn.discordapp.com/attachments/794506942906761226/959913067452436510/117gilbert.png
Crookshanks	120	<rolename> is the definition of fuck around and find out. He's half-kneazle, which means he will blow your shit up if you cross him and he can basically fend for himself even moreso than non-half-kneazle cats. So. Don't cross him. Or he'll come for you. <name>.	https://cdn.discordapp.com/attachments/794506942906761226/959912650660261908/118crookshanks.gif
Rover	121	<rolename> FROM ANIMAL CROSSING, MY SON. *cobs quietly in VC with <name>*.	https://cdn.discordapp.com/attachments/794506942906761226/959912650945495071/119rover.gif
Lolly	122	Yeet, <name>, you like blue now. You're <rolename>.	https://cdn.discordapp.com/attachments/794506942906761226/959912651473948672/120lolly.gif
Olivia	123	You're the best kind of friend, <name> because you make <rolename> look even prettier.	https://cdn.discordapp.com/attachments/794506942906761226/959940812085526558/121olivia.gif
Doctor Shapiro	124	Imagine being a cat with a doctorate degree in superhuman biology. An ACTUAL degree, not an honorary one. That's <rolename>. a highly intelligent little shit who can END you if he so pleases. Together he and Crookshanks are gonna fuck your shit up, <name>.	https://cdn.discordapp.com/attachments/794506942906761226/959938623925526568/122drshaapiro.png
Raymond	125	Everyone is obsessed with you, <rolename>. Congrats. <name>.	https://cdn.discordapp.com/attachments/794506942906761226/959940891143995392/123raymond.gif
Niels	127	FIRE CAT <rolename> GO FAST BRRRR <name>	https://cdn.discordapp.com/attachments/794506942906761226/959913067733463140/124niels.jpg
P.J Pete	128	Not only did you appear in one of Disney's best movies to date, you're also pretty fuckin chill. Congrats <name>, you're <rolename>.	https://cdn.discordapp.com/attachments/794506942906761226/959940939953082428/125pjpete.gif
Pepita	129	Giving new meaning to kittywings, you're <rolename> from Pixar's Coco! <name>.	https://cdn.discordapp.com/attachments/794506942906761226/959941004444717116/127pepita.gif
Salem	130	YEET YOU'RE <rolename>, <name> NOTHING TO SEE HERE.	https://cdn.discordapp.com/attachments/794506942906761226/960029295844151306/cat-halloween.gif
Gatomon	131	DIGIMON DIGITAL MONSTERS <rolename> IS OUR CHAMPION. <name>.	https://cdn.discordapp.com/attachments/794506942906761226/959912651876614214/129gatomon.gif
Katt	132	"I could go for a jog...or I could SAY I'm going for a jog, then go home and do my couch-potato thing." - <rolename> to <name> in Animal Crossing.	https://cdn.discordapp.com/attachments/794506942906761226/959912652291862598/130katt.gif
Aslan	133	"so like this is the rawr rawr big boi from the jesus books. not the bible, the one written by the jesus dude bro. what's his fuck." — me to <name> about <rolename>.	https://cdn.discordapp.com/attachments/794506942906761226/959912653042647080/131aslan.gif
Alpine	134	BABY BOY BABY <rolename>, <name>.	https://cdn.discordapp.com/attachments/741053845098201099/959227332596490260/alpine.png
Scar	135	The most important thing to remember about being <rolename>, <name>, is that no matter what anyone says: you're still alive. This was the previous description of a different character but it felt fucking ominous so I left it in.	https://cdn.discordapp.com/attachments/794506942906761226/959912653298470942/133scar.gif
Doctor Octopussycat	137	You might think <rolename> would be an enemy of Spider-Man (Cat) or Spider-Cat (Also Cat), but he's actually an enemy of SPIDER-HAM. The Spider-Verse is truly a wonder. <name>.	https://cdn.discordapp.com/attachments/794506942906761226/959913068190638220/134doctoroctopussycat.jpeg
Rosie	138	One good purr deserves another. 🥺 You're <rolename>, <name>!	https://cdn.discordapp.com/attachments/794506942906761226/959912821477486653/135rosie.gif
Tangy	139	You're an empath, <name>. Lmao. You're <rolename>.	https://cdn.discordapp.com/attachments/794506942906761226/959941060426088548/137tangy.gif
Keanu	140	Yes <rolename> is a cat, <name>. Shut up.	https://cdn.discordapp.com/attachments/794506942906761226/959912821796257822/138keanu.gif
Snowbell	141	<rolename> is seen as a friendly, shy, and lovable coward. He often focuses first and foremost on his own needs and frequently gets in trouble as a result. Because Capitalism punishes caring for yourself first before you can care for others. Snowbell was right, 2022. <name>.	https://cdn.discordapp.com/attachments/794506942906761226/959912822270226513/139snowbell.gif
Liho	142	BABY CAT BABY PT II <rolename>, <name>.	https://cdn.discordapp.com/attachments/741053845098201099/959227332890099742/liho.png
Mitzi	143	Congratulations <name>! You're <rolename>. You're a real cat now (alledgedly)!	https://cdn.discordapp.com/attachments/794506942906761226/959938686596825128/141mitzi.png
Katz	144	*insert soulja boy meme here while Katz poses menacingly in the background* <name>, you're <rolename>.	https://cdn.discordapp.com/attachments/794506942906761226/959941120937312336/142katz.gif
Azrael	145	Like it's not your fault you got caught up working for an evil demon, <rolename>, but uh...maybe you're a little bit evil too....<name>	https://cdn.discordapp.com/attachments/794506942906761226/959912823541104670/143azrael.gif
Merry	147	You're a semi self-made girlboss nightmare being, <name>. You should probably get therapy. You're <rolename>.	https://cdn.discordapp.com/attachments/794506942906761226/959941178869051463/144merry.gif
Zira	148	I'll never forget the lullaby <rolename> sang about murder to her infant son who grew up to become an emo and marry a prep then banish <rolename> to hell. Lmao. Lions amirite, <name>?	https://cdn.discordapp.com/attachments/794506942906761226/959912824115720242/145zira.gif
Kyubey	149	Do you have any wishes, <name>? Let me grant them. ／人◕ ‿‿ ◕人＼	https://cdn.discordapp.com/attachments/794506942906761226/959941242307895356/147kyubey.gif
Opalescence	150	You're the pet cat of a magical talking unicorn named after a gemstone. Life is good, <name>, life is motherfucking good. You're <rolename>.	https://cdn.discordapp.com/attachments/794506942906761226/959912824749052055/148opalescence.gif
PuppyCat	151	<rolename> came into <name>'s life under strange circumstances. After you takes care of him, he decides to help you by letting you come along on his job to make some cash. Not much is known about <rolename>'s mysterious past, but it may be tied to the fairytale that he tells.	https://cdn.discordapp.com/attachments/794506942906761226/959912825013301258/149puppycat.gif
Chester Cheetah	152	It ain't easy being cheesy, is it <name>? You're <rolename>.	https://cdn.discordapp.com/attachments/794506942906761226/959912825361408040/150chestercheetah.gif
Cheshire Cat	153	We're all mad here. <rolename>'s mad. <name> is mad.	https://cdn.discordapp.com/attachments/794506942906761226/959912825923448882/151cheshirecat.gif
Dex-Starr	154	Cheryl from Riverdale and her Nana Rose like to pretend they invented red, but it was you, wasn't it, <rolename>? <name>	https://cdn.discordapp.com/attachments/794506942906761226/959941294090780722/152dexstarr.gif
Lucifer	155	<rolename> HURRUMPH <name>!	https://cdn.discordapp.com/attachments/794506942906761226/959912897809637376/153lucifer.gif
Nyan Cat	157	<name>, <rolename> Nyan nyan nyan nyan nyan nyan nyan nyan nyan nyan nyan nyan nyan nyan nyan nyan nyan nyan nyan nyan nyan Nyan nyan nyan nyan nyan nyan nyan nyan nyan nyan nyan nyan nyan nyan nyan nyan nyan nyan nyan nyan nyan Nyan nyan nyan nyan nyan nyan nyan nyan nyan nyan nyan nyan nyan nyan nyan nyan nyan nyan nyan nyan nyan Nyan nyan nyan nyan nyan nyan nyan nyan nyan nyan nyan nyan nyan nyan nyan nyan nyan nyan nyan nyan nyan Nyan nyan nyan nyan nyan nyan nyan nyan nyan nyan nyan nyan nyan nyan nyan nyan nyan nyan nyan nyan nyan Nyan nyan nyan nyan nyan nyan nyan nyan nyan nyan nyan nyan nyan nyan nyan nyan nyan nyan nyan nyan nyan Nyan nyan nyan nyan nyan nyan nyan nyan nyan nyan nyan nyan nyan nyan nyan nyan nyan nyan nyan nyan nyan Nyan nyan nyan nyan nyan nyan nyan nyan nyan nyan nyan nyan nyan nyan nyan nyan nyan nyan nyan nyan nyan Nyan nyan nyan nyan nyan nyan nyan nyan nyan nyan nyan nyan nyan nyan nyan nyan nyan nyan nyan nyan nyan Nyan nyan nyan nyan nyan nyan nyan nyan nyan nyan nyan nyan nyan nyan nyan nyan nyan nyan nyan nyan nyan Nyan nyan nyan nyan nyan nyan nyan nyan nyan nyan nyan nyan nyan nyan nyan nyan nyan nyan nyan nyan nyan Nyan nyan nyan nyan nyan nyan nyan nyan nyan nyan nyan nyan nyan nyan nyan nyan nyan nyan nyan nyan nyan Nyan nyan nyan nyan nyan nyan nyan nyan nyan nyan nyan nyan nyan nyan nyan nyan nyan nyan nyan nyan nyan Nyan nyan nyan nyan nyan nyan nyan nyan nyan nyan nyan nyan nyan nyan nyan nyan nyan nyan nyan nyan nyan Nyan nyan nyan nyan nyan nyan nyan nyan nyan nyan nyan nyan nyan nyan nyan nyan nyan nyan nyan nyan nyan Nyan nyan nyan nyan nyan nyan nyan nyan nyan nyan nyan nyan nyan nyan nyan nyan nyan nyan nyan nyan nyan Nyan nyan nyan nyan nyan nyan nyan nyan nyan nyan nyan nyan nyan nyan nyan nyan nyan nyan nyan nyan nyan....	https://cdn.discordapp.com/attachments/794506942906761226/959912898157756486/154nyancat.gif
Super Mega Supreme Bastard	177	Congratulations <name>! You're <rolename>. I don't know how to say this, but you've somehow become more of a chaotic swampy wench than the actual devil. Are you okay? Do you need us to call someone?	https://cdn.discordapp.com/attachments/794506942906761226/948140541164531722/bastard.gif